{
  "schema_version": 1,
  "kind": "opensspm.test_case",
  "rule_key": "OKTA-APP-000020",
  "description": "Should pass when maxSessionIdleMinutes is exactly 15",
  "inputs": {
    "okta:policies/sign-on": [
      {
        "policy": { "name": "Default Policy" },
        "priority": 1,
        "name": "Custom Rule",
        "actions": { "signon": { "session": { "maxSessionIdleMinutes": 15 } } }
      }
    ]
  },
  "expect": "pass"
}
